<?xml version="1.0" encoding="UTF-8"?>

<!DOCTYPE articles SYSTEM "articles.dtd">

<articles>
  <article id="x34675">
    <name>Apache Spark Architecture</name>
    <month>december</month>
    <author name="kay vennisla"/>
    <reviews lang=""/>
    <feedback> high rating</feedback>
    <reviews lang="de">The best content with diagrams</reviews>
  </article>
</articles>